{
  "checkpoints": [
    {
      "acceptance_eligible": true,
      "evidence_kind": "direct",
      "id": "home.loaded.desktop",
      "priority": "p0",
      "route_id": "home",
      "state": "loaded",
      "verification_kind": "browser-capture",
      "viewport": "desktop",
      "visual_contract": {
        "source_artifact_path": "source-current/2026-08-20.crumbl-cookies-r1/home/desktop/frame-1.viewport.png",
        "viewport": {
          "width": 1440,
          "height": 900
        },
        "comparison_region": {
          "x": 0,
          "y": 720,
          "width": 1440,
          "height": 180
        },
        "metric": "pixel-mae-similarity-v1",
        "threshold": 0.99
      }
    },
    {
      "acceptance_eligible": true,
      "evidence_kind": "structural-only",
      "id": "menu.loaded.desktop",
      "priority": "p0",
      "route_id": "menu",
      "state": "loaded",
      "verification_kind": "browser-capture",
      "viewport": "desktop"
    },
    {
      "acceptance_eligible": true,
      "evidence_kind": "direct",
      "id": "flavor-profile.creme-brulee.desktop",
      "priority": "p0",
      "route_id": "flavor-profile",
      "state": "loaded",
      "verification_kind": "browser-capture",
      "viewport": "desktop"
    },
    {
      "acceptance_eligible": true,
      "evidence_kind": "direct",
      "id": "stores.loaded.desktop",
      "priority": "p0",
      "route_id": "stores",
      "state": "loaded",
      "verification_kind": "browser-capture",
      "viewport": "desktop"
    },
    {
      "acceptance_eligible": true,
      "evidence_kind": "direct",
      "id": "store-detail.loaded.desktop",
      "priority": "p0",
      "route_id": "store-detail",
      "state": "loaded",
      "verification_kind": "browser-capture",
      "viewport": "desktop"
    },
    {
      "acceptance_eligible": true,
      "evidence_kind": "structural-only",
      "id": "order.loaded.desktop",
      "priority": "p0",
      "route_id": "order",
      "state": "loaded",
      "verification_kind": "browser-capture",
      "viewport": "desktop"
    },
    {
      "acceptance_eligible": true,
      "evidence_kind": "structural-only",
      "id": "order-pickup.store-selected.desktop",
      "priority": "p0",
      "route_id": "order-pickup",
      "state": "store-selected",
      "verification_kind": "browser-capture",
      "viewport": "desktop"
    },
    {
      "acceptance_eligible": true,
      "evidence_kind": "structural-only",
      "id": "order-pickup.checkout-review.desktop",
      "priority": "p0",
      "route_id": "order-pickup",
      "state": "checkout-review",
      "verification_kind": "browser-capture",
      "viewport": "desktop"
    },
    {
      "acceptance_eligible": true,
      "evidence_kind": "structural-only",
      "id": "order-pickup.confirmation.desktop",
      "priority": "p0",
      "route_id": "order-pickup",
      "state": "confirmation",
      "verification_kind": "browser-capture",
      "viewport": "desktop"
    },
    {
      "acceptance_eligible": true,
      "evidence_kind": "structural-only",
      "id": "order-delivery.checkout-review.desktop",
      "priority": "p0",
      "route_id": "order-delivery",
      "state": "checkout-review",
      "verification_kind": "browser-capture",
      "viewport": "desktop"
    },
    {
      "acceptance_eligible": true,
      "evidence_kind": "structural-only",
      "id": "order-delivery.confirmation.desktop",
      "priority": "p0",
      "route_id": "order-delivery",
      "state": "confirmation",
      "verification_kind": "browser-capture",
      "viewport": "desktop"
    },
    {
      "acceptance_eligible": true,
      "evidence_kind": "structural-only",
      "id": "not-found.loaded.desktop",
      "priority": "p1",
      "route_id": "not-found",
      "state": "loaded",
      "verification_kind": "browser-capture",
      "viewport": "desktop"
    }
  ],
  "schema_version": "offline-clone.checkpoints.v1",
  "status": "draft",
  "viewports": {
    "desktop": {
      "height": 900,
      "width": 1440
    },
    "mobile": {
      "height": 844,
      "width": 390
    }
  }
}
